{
  "lead_id": "lead-safe-001",
  "clinic_name": "Clinica Horizonte Ficticia",
  "source": "google_places",
  "has_website": false,
  "website_quality": "none",
  "google_rating": 4.6,
  "review_count": 42,
  "category": "clinica odontologica",
  "city": "Curitiba",
  "neighborhood": "Centro",
  "offer_lane": "website_seo",
  "lead_temperature": "cold",
  "cold_outreach_message_count": 1,
  "message_variant": "cold_first_short_v1",
  "message_sent": "Oi, tudo bem? Encontrei a clinica no Google. Aqui e o time comercial da ClinicFlux AI. Posso falar com quem cuida do WhatsApp e dos agendamentos?",
  "clinic_replied": false,
  "reply_time_minutes": null,
  "auto_reply_received": false,
  "human_reply_received": false,
  "first_human_message_received": false,
  "first_human_message_at": null,
  "last_human_reply_at": null,
  "reply_type": "none",
  "detected_persona": "unknown",
  "detected_intent": "unknown",
  "outside_24h_window": false,
  "template_required": false,
  "template_used": false,
  "stop_contact_required": false,
  "do_not_follow_up": false,
  "opt_in_status": "public_business_contact",
  "do_not_contact": false,
  "max_remaining_cold_messages": 1,
  "analysis_mode": "economico",
  "token_efficiency_mode": "economico",
  "token_budget_level": "low",
  "should_use_elite_mode": false,
  "elite_mode_reason": "elite_blocked_for_cold_lead_without_human_reply",
  "estimated_token_cost_level": "low",
  "data_loading_strategy": "minimal",
  "large_context_allowed": false,
  "objection_type": "none",
  "stage_reached": "first_message",
  "demo_clicked": false,
  "whatsapp_tested": false,
  "meeting_booked": false,
  "proposal_sent": false,
  "closed_sale": false,
  "lost_reason": null,
  "conversation_score": 45,
  "message_quality_score": 88,
  "commercial_risk_score": 42,
  "burn_risk": "medium",
  "what_worked": ["Mensagem curta e transparente"],
  "what_failed": [],
  "missed_opportunities": [],
  "next_best_action": "wait",
  "next_best_message": "",
  "improvement_notes": ["Aguardar resposta humana antes de qualquer demo."],
  "tags": ["fictional", "cold", "economico"],
  "microconversions": {
    "message_sent": true,
    "clinic_replied": false,
    "asked_source": false,
    "asked_price": false,
    "asked_info": false,
    "responsible_identified": false,
    "demo_sent": false,
    "demo_clicked": false,
    "whatsapp_tested": false,
    "booking_attempted": false,
    "meeting_booked": false,
    "proposal_sent": false,
    "closed_sale": false,
    "lost": false
  },
  "created_at": "2026-05-29T09:00:00Z"
}
