{
  "lead_id": "lead-demo-001",
  "clinic_name": "Clinica Aurora Ficticia",
  "source": "google_places",
  "has_website": false,
  "website_quality": "none",
  "google_rating": 4.7,
  "review_count": 86,
  "category": "clinica odontologica",
  "city": "Curitiba",
  "neighborhood": "Batel",
  "offer_lane": "website_seo",
  "lead_temperature": "warm",
  "cold_outreach_message_count": 1,
  "message_variant": "google_no_website_v1",
  "message_sent": "Oi, tudo bem? Encontrei a clinica no Google e vi que nao aparece um site vinculado. Aqui e o time comercial da ClinicFlux AI. Posso falar com quem cuida do WhatsApp e dos agendamentos?",
  "clinic_replied": true,
  "reply_time_minutes": 34,
  "auto_reply_received": false,
  "human_reply_received": true,
  "first_human_message_received": false,
  "first_human_message_at": null,
  "last_human_reply_at": "2026-05-29T12:34:00Z",
  "reply_type": "asked_source",
  "detected_persona": "reception",
  "detected_intent": "route_responsible",
  "outside_24h_window": false,
  "template_required": false,
  "template_used": false,
  "stop_contact_required": false,
  "do_not_follow_up": false,
  "opt_in_status": "human_replied",
  "do_not_contact": false,
  "max_remaining_cold_messages": 2,
  "analysis_mode": "profissional",
  "token_efficiency_mode": "profissional",
  "token_budget_level": "medium",
  "should_use_elite_mode": false,
  "elite_mode_reason": "",
  "estimated_token_cost_level": "medium",
  "data_loading_strategy": "recent_events_only",
  "large_context_allowed": false,
  "objection_type": "source",
  "stage_reached": "replied",
  "demo_clicked": false,
  "whatsapp_tested": false,
  "meeting_booked": false,
  "proposal_sent": false,
  "closed_sale": false,
  "lost_reason": null,
  "conversation_score": 82,
  "message_quality_score": 91,
  "commercial_risk_score": 18,
  "burn_risk": "low",
  "what_worked": [
    "Identidade comercial clara",
    "Contexto real do Google usado sem julgamento",
    "Uma pergunta objetiva para roteamento"
  ],
  "what_failed": [
    "Nao explicou ainda qual busca levou a clinica"
  ],
  "missed_opportunities": [
    "Responder a pergunta de origem antes de pedir o decisor novamente"
  ],
  "next_best_action": "reply_contextually",
  "next_best_message": "Encontrei voces no Google pesquisando por clinica odontologica na regiao. Meu contato e comercial: a ideia e mostrar oportunidades simples para melhorar site, WhatsApp e agendamentos. Quem cuida dessa parte por ai?",
  "improvement_notes": [
    "Quando a clinica perguntar a fonte, responder diretamente antes de vender"
  ],
  "tags": [
    "sample",
    "fictional",
    "no_website",
    "source_question"
  ],
  "microconversions": {
    "message_sent": true,
    "clinic_replied": true,
    "asked_source": true,
    "asked_price": false,
    "asked_info": false,
    "responsible_identified": false,
    "demo_sent": false,
    "demo_clicked": false,
    "whatsapp_tested": false,
    "booking_attempted": false,
    "meeting_booked": false,
    "proposal_sent": false,
    "closed_sale": false,
    "lost": false
  },
  "created_at": "2026-05-29T12:00:00Z"
}
