{
  "lead_id": "lead-safe-007",
  "clinic_name": "Clinica Demo Clara Ficticia",
  "source": "google_maps",
  "has_website": true,
  "website_quality": "good",
  "google_rating": 4.8,
  "review_count": 101,
  "category": "dentista",
  "city": "Recife",
  "neighborhood": "Boa Viagem",
  "offer_lane": "demo",
  "lead_temperature": "hot",
  "cold_outreach_message_count": 1,
  "message_variant": "demo_request_v1",
  "message_sent": "Perfeito. Vou te mandar uma demo rapida para voce testar como se fosse um paciente falando com a clinica pelo WhatsApp.",
  "clinic_replied": true,
  "reply_time_minutes": 9,
  "auto_reply_received": false,
  "human_reply_received": true,
  "first_human_message_received": false,
  "first_human_message_at": null,
  "last_human_reply_at": "2026-05-29T15:00:00Z",
  "reply_type": "asked_info",
  "detected_persona": "manager",
  "detected_intent": "request_demo",
  "outside_24h_window": false,
  "template_required": false,
  "template_used": false,
  "stop_contact_required": false,
  "do_not_follow_up": false,
  "opt_in_status": "requested_information",
  "do_not_contact": false,
  "max_remaining_cold_messages": 2,
  "analysis_mode": "elite_300",
  "token_efficiency_mode": "elite_300",
  "token_budget_level": "high",
  "should_use_elite_mode": true,
  "elite_mode_reason": "requested_demo",
  "estimated_token_cost_level": "high",
  "data_loading_strategy": "recent_events_only",
  "large_context_allowed": true,
  "objection_type": "none",
  "stage_reached": "replied",
  "demo_clicked": false,
  "whatsapp_tested": false,
  "meeting_booked": false,
  "proposal_sent": false,
  "closed_sale": false,
  "lost_reason": null,
  "conversation_score": 88,
  "message_quality_score": 92,
  "commercial_risk_score": 18,
  "burn_risk": "low",
  "what_worked": ["Pedido de demo justifica modo elite"],
  "what_failed": [],
  "missed_opportunities": [],
  "next_best_action": "send_demo",
  "next_best_message": "Enviar demo curta e registrar clique/teste.",
  "improvement_notes": ["Nao carregar campanha inteira para decisao individual."],
  "tags": ["fictional", "demo", "elite_300"],
  "microconversions": {
    "message_sent": true,
    "clinic_replied": true,
    "asked_source": false,
    "asked_price": false,
    "asked_info": true,
    "responsible_identified": false,
    "demo_sent": true,
    "demo_clicked": false,
    "whatsapp_tested": false,
    "booking_attempted": false,
    "meeting_booked": false,
    "proposal_sent": false,
    "closed_sale": false,
    "lost": false
  },
  "created_at": "2026-05-29T15:05:00Z"
}
