{
  "lead_id": "lead-safe-002",
  "clinic_name": "Clinica Aurora Norte Ficticia",
  "source": "google_maps",
  "has_website": true,
  "website_quality": "average",
  "google_rating": 4.5,
  "review_count": 35,
  "category": "dentista",
  "city": "Sao Paulo",
  "neighborhood": "Moema",
  "offer_lane": "clinicflux_ai",
  "lead_temperature": "cold",
  "cold_outreach_message_count": 1,
  "message_variant": "cold_first_transparent_v1",
  "message_sent": "Oi, tudo bem? Encontrei a clinica no Google. Aqui e o time comercial da ClinicFlux AI. Posso falar com quem cuida do WhatsApp e dos agendamentos?",
  "clinic_replied": true,
  "reply_time_minutes": 1,
  "auto_reply_received": true,
  "human_reply_received": false,
  "first_human_message_received": false,
  "first_human_message_at": null,
  "last_human_reply_at": null,
  "reply_type": "auto_reply",
  "detected_persona": "automation",
  "detected_intent": "unknown",
  "outside_24h_window": false,
  "template_required": false,
  "template_used": false,
  "stop_contact_required": false,
  "do_not_follow_up": false,
  "opt_in_status": "public_business_contact",
  "do_not_contact": false,
  "max_remaining_cold_messages": 1,
  "analysis_mode": "economico",
  "token_efficiency_mode": "economico",
  "token_budget_level": "low",
  "should_use_elite_mode": false,
  "elite_mode_reason": "elite_blocked_for_cold_lead_without_human_reply",
  "estimated_token_cost_level": "low",
  "data_loading_strategy": "minimal",
  "large_context_allowed": false,
  "objection_type": "none",
  "stage_reached": "replied",
  "demo_clicked": false,
  "whatsapp_tested": false,
  "meeting_booked": false,
  "proposal_sent": false,
  "closed_sale": false,
  "lost_reason": null,
  "conversation_score": 40,
  "message_quality_score": 87,
  "commercial_risk_score": 38,
  "burn_risk": "medium",
  "what_worked": ["Auto-resposta separada de resposta humana"],
  "what_failed": [],
  "missed_opportunities": [],
  "next_best_action": "send_second_commercial_clarification",
  "next_best_message": "Obrigado. Meu contato e comercial, nao e para agendamento de paciente. Aqui e o time da ClinicFlux AI. Queria falar com quem cuida do WhatsApp e dos agendamentos da clinica. Se nao fizer sentido, sem problema.",
  "improvement_notes": ["Enviar no maximo uma segunda mensagem curta."],
  "tags": ["fictional", "auto_reply", "economico"],
  "microconversions": {
    "message_sent": true,
    "clinic_replied": true,
    "asked_source": false,
    "asked_price": false,
    "asked_info": false,
    "responsible_identified": false,
    "demo_sent": false,
    "demo_clicked": false,
    "whatsapp_tested": false,
    "booking_attempted": false,
    "meeting_booked": false,
    "proposal_sent": false,
    "closed_sale": false,
    "lost": false
  },
  "created_at": "2026-05-29T09:05:00Z"
}
