{
  "lead_id": "lead-safe-009",
  "clinic_name": "Clinica Janela Ficticia",
  "source": "public_website",
  "has_website": true,
  "website_quality": "weak",
  "google_rating": 4.2,
  "review_count": 18,
  "category": "dentista",
  "city": "Salvador",
  "neighborhood": "Pituba",
  "offer_lane": "audit",
  "lead_temperature": "cold",
  "cold_outreach_message_count": 1,
  "message_variant": "outside_24h_template_gate_v1",
  "message_sent": "",
  "clinic_replied": false,
  "reply_time_minutes": null,
  "auto_reply_received": false,
  "human_reply_received": false,
  "first_human_message_received": false,
  "first_human_message_at": null,
  "last_human_reply_at": null,
  "reply_type": "none",
  "detected_persona": "unknown",
  "detected_intent": "unknown",
  "outside_24h_window": true,
  "template_required": true,
  "template_used": false,
  "stop_contact_required": true,
  "do_not_follow_up": true,
  "opt_in_status": "public_business_contact",
  "do_not_contact": false,
  "max_remaining_cold_messages": 0,
  "analysis_mode": "economico",
  "token_efficiency_mode": "economico",
  "token_budget_level": "low",
  "should_use_elite_mode": false,
  "elite_mode_reason": "elite_blocked_for_cold_lead_without_human_reply",
  "estimated_token_cost_level": "low",
  "data_loading_strategy": "minimal",
  "large_context_allowed": false,
  "objection_type": "none",
  "stage_reached": "first_message",
  "demo_clicked": false,
  "whatsapp_tested": false,
  "meeting_booked": false,
  "proposal_sent": false,
  "closed_sale": false,
  "lost_reason": null,
  "conversation_score": 30,
  "message_quality_score": 0,
  "commercial_risk_score": 88,
  "burn_risk": "critical",
  "what_worked": ["Mensagem livre bloqueada fora da janela de 24h"],
  "what_failed": [],
  "missed_opportunities": [],
  "next_best_action": "stop_contact_or_use_approved_template_only",
  "next_best_message": "",
  "improvement_notes": ["Usar somente template aprovado se permitido pela API."],
  "tags": ["fictional", "outside_24h", "template_required"],
  "microconversions": {
    "message_sent": false,
    "clinic_replied": false,
    "asked_source": false,
    "asked_price": false,
    "asked_info": false,
    "responsible_identified": false,
    "demo_sent": false,
    "demo_clicked": false,
    "whatsapp_tested": false,
    "booking_attempted": false,
    "meeting_booked": false,
    "proposal_sent": false,
    "closed_sale": false,
    "lost": false
  },
  "created_at": "2026-05-29T17:05:00Z"
}
