{
  "lead_id": "lead-safe-008",
  "clinic_name": "Clinica Pausa Ficticia",
  "source": "manual",
  "has_website": true,
  "website_quality": "average",
  "google_rating": 4.3,
  "review_count": 25,
  "category": "clinica odontologica",
  "city": "Goiania",
  "neighborhood": "Setor Oeste",
  "offer_lane": "stop",
  "lead_temperature": "lost",
  "cold_outreach_message_count": 1,
  "message_variant": "stop_request_v1",
  "message_sent": "",
  "clinic_replied": true,
  "reply_time_minutes": 20,
  "auto_reply_received": false,
  "human_reply_received": true,
  "first_human_message_received": false,
  "first_human_message_at": null,
  "last_human_reply_at": "2026-05-29T16:00:00Z",
  "reply_type": "decline",
  "detected_persona": "manager",
  "detected_intent": "refuse",
  "outside_24h_window": false,
  "template_required": false,
  "template_used": false,
  "stop_contact_required": true,
  "do_not_follow_up": true,
  "opt_in_status": "do_not_contact",
  "do_not_contact": true,
  "max_remaining_cold_messages": 0,
  "analysis_mode": "profissional",
  "token_efficiency_mode": "profissional",
  "token_budget_level": "medium",
  "should_use_elite_mode": false,
  "elite_mode_reason": "",
  "estimated_token_cost_level": "medium",
  "data_loading_strategy": "lead_profile_only",
  "large_context_allowed": false,
  "objection_type": "no_interest",
  "stage_reached": "lost",
  "demo_clicked": false,
  "whatsapp_tested": false,
  "meeting_booked": false,
  "proposal_sent": false,
  "closed_sale": false,
  "lost_reason": "requested_stop_contact",
  "conversation_score": 5,
  "message_quality_score": 0,
  "commercial_risk_score": 100,
  "burn_risk": "critical",
  "what_worked": ["Pedido de parar contato respeitado"],
  "what_failed": [],
  "missed_opportunities": [],
  "next_best_action": "stop_contact",
  "next_best_message": "",
  "improvement_notes": ["Nao enviar follow-up."],
  "tags": ["fictional", "do_not_contact"],
  "microconversions": {
    "message_sent": false,
    "clinic_replied": true,
    "asked_source": false,
    "asked_price": false,
    "asked_info": false,
    "responsible_identified": false,
    "demo_sent": false,
    "demo_clicked": false,
    "whatsapp_tested": false,
    "booking_attempted": false,
    "meeting_booked": false,
    "proposal_sent": false,
    "closed_sale": false,
    "lost": true
  },
  "created_at": "2026-05-29T16:05:00Z"
}
