{
  "lead_id": "lead-safe-004",
  "clinic_name": "Clinica Manha Clara Ficticia",
  "source": "google_places",
  "has_website": true,
  "website_quality": "average",
  "google_rating": 4.8,
  "review_count": 76,
  "category": "clinica odontologica",
  "city": "Florianopolis",
  "neighborhood": "Centro",
  "offer_lane": "clinicflux_ai",
  "lead_temperature": "warm",
  "cold_outreach_message_count": 0,
  "message_variant": "human_first_contextual_v1",
  "message_sent": "Bom dia! Aqui e o time comercial da ClinicFlux AI. Meu contato e sobre atendimento e agendamentos no WhatsApp, nao e para consulta. Voces tem alguem responsavel por essa parte?",
  "clinic_replied": true,
  "reply_time_minutes": 0,
  "auto_reply_received": false,
  "human_reply_received": true,
  "first_human_message_received": true,
  "first_human_message_at": "2026-05-29T11:00:00Z",
  "last_human_reply_at": "2026-05-29T11:00:00Z",
  "reply_type": "human_reply",
  "detected_persona": "reception",
  "detected_intent": "learn_more",
  "outside_24h_window": false,
  "template_required": false,
  "template_used": false,
  "stop_contact_required": false,
  "do_not_follow_up": false,
  "opt_in_status": "human_replied",
  "do_not_contact": false,
  "max_remaining_cold_messages": 2,
  "analysis_mode": "profissional",
  "token_efficiency_mode": "profissional",
  "token_budget_level": "medium",
  "should_use_elite_mode": false,
  "elite_mode_reason": "",
  "estimated_token_cost_level": "medium",
  "data_loading_strategy": "lead_profile_only",
  "large_context_allowed": false,
  "objection_type": "none",
  "stage_reached": "replied",
  "demo_clicked": false,
  "whatsapp_tested": false,
  "meeting_booked": false,
  "proposal_sent": false,
  "closed_sale": false,
  "lost_reason": null,
  "conversation_score": 72,
  "message_quality_score": 90,
  "commercial_risk_score": 15,
  "burn_risk": "low",
  "what_worked": ["Primeira mensagem humana classificada como conversa real"],
  "what_failed": [],
  "missed_opportunities": [],
  "next_best_action": "reply_contextually",
  "next_best_message": "Responder diretamente mantendo transparencia comercial.",
  "improvement_notes": ["Usar historico minimo do perfil do lead."],
  "tags": ["fictional", "human_first", "profissional"],
  "microconversions": {
    "message_sent": true,
    "clinic_replied": true,
    "asked_source": false,
    "asked_price": false,
    "asked_info": true,
    "responsible_identified": false,
    "demo_sent": false,
    "demo_clicked": false,
    "whatsapp_tested": false,
    "booking_attempted": false,
    "meeting_booked": false,
    "proposal_sent": false,
    "closed_sale": false,
    "lost": false
  },
  "created_at": "2026-05-29T11:00:00Z"
}
