{
  "lead_id": "lead-safe-006",
  "clinic_name": "Clinica Valor Justo Ficticia",
  "source": "google_places",
  "has_website": true,
  "website_quality": "strong",
  "google_rating": 4.9,
  "review_count": 135,
  "category": "clinica odontologica",
  "city": "Porto Alegre",
  "neighborhood": "Moinhos",
  "offer_lane": "clinicflux_ai",
  "lead_temperature": "hot",
  "cold_outreach_message_count": 1,
  "message_variant": "price_answer_route_v1",
  "message_sent": "Consigo te passar uma nocao, mas para nao chutar valor errado eu prefiro primeiro validar o fluxo de WhatsApp e agenda de voces. Posso te mandar um resumo objetivo?",
  "clinic_replied": true,
  "reply_time_minutes": 18,
  "auto_reply_received": false,
  "human_reply_received": true,
  "first_human_message_received": false,
  "first_human_message_at": null,
  "last_human_reply_at": "2026-05-29T14:00:00Z",
  "reply_type": "asked_price",
  "detected_persona": "owner",
  "detected_intent": "ask_price",
  "outside_24h_window": false,
  "template_required": false,
  "template_used": false,
  "stop_contact_required": false,
  "do_not_follow_up": false,
  "opt_in_status": "human_replied",
  "do_not_contact": false,
  "max_remaining_cold_messages": 2,
  "analysis_mode": "elite_300",
  "token_efficiency_mode": "elite_300",
  "token_budget_level": "high",
  "should_use_elite_mode": true,
  "elite_mode_reason": "asked_price",
  "estimated_token_cost_level": "high",
  "data_loading_strategy": "recent_events_only",
  "large_context_allowed": true,
  "objection_type": "price",
  "stage_reached": "replied",
  "demo_clicked": false,
  "whatsapp_tested": false,
  "meeting_booked": false,
  "proposal_sent": false,
  "closed_sale": false,
  "lost_reason": null,
  "conversation_score": 86,
  "message_quality_score": 89,
  "commercial_risk_score": 22,
  "burn_risk": "low",
  "what_worked": ["Pergunta de preco indica intencao comercial real"],
  "what_failed": [],
  "missed_opportunities": [],
  "next_best_action": "send_summary",
  "next_best_message": "Enviar resumo curto e rota de demo antes de proposta.",
  "improvement_notes": ["Usar elite apenas por sinal forte."],
  "tags": ["fictional", "price", "elite_300"],
  "microconversions": {
    "message_sent": true,
    "clinic_replied": true,
    "asked_source": false,
    "asked_price": true,
    "asked_info": false,
    "responsible_identified": false,
    "demo_sent": false,
    "demo_clicked": false,
    "whatsapp_tested": false,
    "booking_attempted": false,
    "meeting_booked": false,
    "proposal_sent": false,
    "closed_sale": false,
    "lost": false
  },
  "created_at": "2026-05-29T14:05:00Z"
}
