{
  "lead_id": "lead-safe-005",
  "clinic_name": "Clinica Sorriso Azul Ficticia",
  "source": "google_places",
  "has_website": true,
  "website_quality": "good",
  "google_rating": 4.7,
  "review_count": 92,
  "category": "dentista",
  "city": "Belo Horizonte",
  "neighborhood": "Savassi",
  "offer_lane": "clinicflux_ai",
  "lead_temperature": "warm",
  "cold_outreach_message_count": 1,
  "message_variant": "permission_to_send_demo_v1",
  "message_sent": "Perfeito. Vou te mandar uma demo rapida para voce testar como se fosse um paciente falando com a clinica pelo WhatsApp.",
  "clinic_replied": true,
  "reply_time_minutes": 12,
  "auto_reply_received": false,
  "human_reply_received": true,
  "first_human_message_received": false,
  "first_human_message_at": null,
  "last_human_reply_at": "2026-05-29T13:00:00Z",
  "reply_type": "permission_to_send",
  "detected_persona": "manager",
  "detected_intent": "learn_more",
  "outside_24h_window": false,
  "template_required": false,
  "template_used": false,
  "stop_contact_required": false,
  "do_not_follow_up": false,
  "opt_in_status": "requested_information",
  "do_not_contact": false,
  "max_remaining_cold_messages": 2,
  "analysis_mode": "profissional",
  "token_efficiency_mode": "profissional",
  "token_budget_level": "medium",
  "should_use_elite_mode": false,
  "elite_mode_reason": "",
  "estimated_token_cost_level": "medium",
  "data_loading_strategy": "recent_events_only",
  "large_context_allowed": false,
  "objection_type": "none",
  "stage_reached": "replied",
  "demo_clicked": false,
  "whatsapp_tested": false,
  "meeting_booked": false,
  "proposal_sent": false,
  "closed_sale": false,
  "lost_reason": null,
  "conversation_score": 78,
  "message_quality_score": 91,
  "commercial_risk_score": 18,
  "burn_risk": "low",
  "what_worked": ["Permissao humana para enviar demo"],
  "what_failed": [],
  "missed_opportunities": [],
  "next_best_action": "send_demo",
  "next_best_message": "Enviar demo curta sem pitch longo.",
  "improvement_notes": ["Manter uma unica proxima acao."],
  "tags": ["fictional", "permission", "profissional"],
  "microconversions": {
    "message_sent": true,
    "clinic_replied": true,
    "asked_source": false,
    "asked_price": false,
    "asked_info": true,
    "responsible_identified": false,
    "demo_sent": true,
    "demo_clicked": false,
    "whatsapp_tested": false,
    "booking_attempted": false,
    "meeting_booked": false,
    "proposal_sent": false,
    "closed_sale": false,
    "lost": false
  },
  "created_at": "2026-05-29T13:05:00Z"
}
