{
  "lead_id": "lead-safe-003",
  "clinic_name": "Clinica Bela Vista Ficticia",
  "source": "prospecting_list",
  "has_website": true,
  "website_quality": "good",
  "google_rating": 4.4,
  "review_count": 57,
  "category": "clinica odontologica",
  "city": "Campinas",
  "neighborhood": "Cambui",
  "offer_lane": "clinicflux_ai",
  "lead_temperature": "cold",
  "cold_outreach_message_count": 2,
  "message_variant": "second_commercial_clarification_v1",
  "message_sent": "Obrigado. Meu contato e comercial, nao e para agendamento de paciente. Aqui e o time da ClinicFlux AI. Queria falar com quem cuida do WhatsApp e dos agendamentos da clinica. Se nao fizer sentido, sem problema.",
  "clinic_replied": true,
  "reply_time_minutes": 1,
  "auto_reply_received": true,
  "human_reply_received": false,
  "first_human_message_received": false,
  "first_human_message_at": null,
  "last_human_reply_at": null,
  "reply_type": "no_human_reply_after_second_message",
  "detected_persona": "automation",
  "detected_intent": "unknown",
  "outside_24h_window": false,
  "template_required": false,
  "template_used": false,
  "stop_contact_required": true,
  "do_not_follow_up": true,
  "opt_in_status": "public_business_contact",
  "do_not_contact": false,
  "max_remaining_cold_messages": 0,
  "analysis_mode": "economico",
  "token_efficiency_mode": "economico",
  "token_budget_level": "low",
  "should_use_elite_mode": false,
  "elite_mode_reason": "elite_blocked_for_cold_lead_without_human_reply",
  "estimated_token_cost_level": "low",
  "data_loading_strategy": "minimal",
  "large_context_allowed": false,
  "objection_type": "none",
  "stage_reached": "lost",
  "demo_clicked": false,
  "whatsapp_tested": false,
  "meeting_booked": false,
  "proposal_sent": false,
  "closed_sale": false,
  "lost_reason": "no_human_reply_after_two_cold_messages",
  "conversation_score": 20,
  "message_quality_score": 82,
  "commercial_risk_score": 80,
  "burn_risk": "critical",
  "what_worked": ["Contato interrompido antes de insistencia"],
  "what_failed": ["Nao houve resposta humana"],
  "missed_opportunities": [],
  "next_best_action": "stop_contact",
  "next_best_message": "",
  "improvement_notes": ["Nao sugerir terceira mensagem fria."],
  "tags": ["fictional", "stop_contact", "economico"],
  "microconversions": {
    "message_sent": true,
    "clinic_replied": true,
    "asked_source": false,
    "asked_price": false,
    "asked_info": false,
    "responsible_identified": false,
    "demo_sent": false,
    "demo_clicked": false,
    "whatsapp_tested": false,
    "booking_attempted": false,
    "meeting_booked": false,
    "proposal_sent": false,
    "closed_sale": false,
    "lost": true
  },
  "created_at": "2026-05-29T09:10:00Z"
}
